{
    "schema_version":  "1.0",
    "run_id":  "run-20261015-050818",
    "project_id":  "task-001-csv-ledger",
    "objective":  "Normalize CSV ledger rows and aggregate exact decimal amounts",
    "status":  "RUNNING",
    "created_at":  "2026-10-15T05:08:18.9026063-03:00",
    "updated_at":  "2026-10-15T05:19:55.2925275-03:00",
    "cycle":  0,
    "max_cycles":  5,
    "current_phase":  "RUNNER",
    "current_task":  "awaiting approved sandbox controlled crash",
    "completed_tasks":  [

                        ],
    "pending_tasks":  [
                          "Normalize CSV ledger rows and aggregate exact decimal amounts"
                      ],
    "acceptance_criteria":  [
                                "Normalize CSV ledger rows and aggregate exact decimal amounts; immutable acceptance and documented CLI verified"
                            ],
    "current_delegation_id":  null,
    "hermes_session_id":  null,
    "qwen_session_id":  null,
    "git":  {
                "branch":  "agent/f25-20261015-050751-1239ed-1",
                "head":  "8d65eca",
                "dirty":  true,
                "changed_files":  [
                                      "README.md",
                                      "module.py"
                                  ]
            },
    "tests":  {
                  "status":  "NONE",
                  "last_command":  null,
                  "last_exit_code":  null,
                  "last_run_at":  null
              },
    "build":  {
                  "status":  "NONE",
                  "last_command":  null,
                  "last_exit_code":  null
              },
    "progress":  {
                     "score":  0,
                     "last_progress_at":  null,
                     "no_progress_cycles":  0
                 },
    "failure":  {
                    "last_signature":  null,
                    "repeated_count":  0
                },
    "checkpoint":  {
                       "last_id":  null,
                       "last_created_at":  null
                   },
    "next_action":  "Continuar ejecución de tarea pendiente: Normalize CSV ledger rows and aggregate exact decimal amounts"
}