{
    "schema_version":  "1.0",
    "run_id":  "run-20261015-121836",
    "project_id":  "task-008-intervals",
    "objective":  "Merge integer time intervals and compute gaps and peak concurrency",
    "status":  "COMPLETED",
    "created_at":  "2026-10-15T12:18:37.2191839-03:00",
    "updated_at":  "2026-10-15T12:25:13.2308021-03:00",
    "cycle":  0,
    "max_cycles":  5,
    "current_phase":  "RUNNER",
    "current_task":  "terminal: ",
    "completed_tasks":  [
                            "Merge integer time intervals and compute gaps and peak concurrency"
                        ],
    "pending_tasks":  [

                      ],
    "acceptance_criteria":  [
                                "Merge integer time intervals and compute gaps and peak concurrency; immutable acceptance and documented CLI verified"
                            ],
    "current_delegation_id":  null,
    "hermes_session_id":  null,
    "qwen_session_id":  null,
    "git":  {
                "branch":  "agent/4h-20261015-110202-059517-8",
                "head":  "7d2a62d",
                "dirty":  true,
                "changed_files":  [
                                      "README.md",
                                      "module.py"
                                  ]
            },
    "tests":  {
                  "status":  "PASS",
                  "last_command":  null,
                  "last_exit_code":  null,
                  "last_run_at":  null
              },
    "build":  {
                  "status":  "PASS",
                  "last_command":  null,
                  "last_exit_code":  null
              },
    "progress":  {
                     "score":  0,
                     "last_progress_at":  null,
                     "no_progress_cycles":  0
                 },
    "failure":  {
                    "last_signature":  null,
                    "repeated_count":  0
                },
    "checkpoint":  {
                       "last_id":  "chk-runner-20261015122512895",
                       "last_created_at":  "2026-10-15T12:25:13.2287953-03:00"
                   },
    "next_action":  "Ejecutar preflight checks y autorizar el inicio del ciclo"
}