{
    "schema_version":  "1.0",
    "run_id":  "run-20261015-064443",
    "project_id":  "task-011-intervals",
    "objective":  "Merge integer time intervals and compute gaps and peak concurrency",
    "status":  "COMPLETED",
    "created_at":  "2026-10-15T06:44:43.4752635-03:00",
    "updated_at":  "2026-10-15T06:54:34.0722137-03:00",
    "cycle":  0,
    "max_cycles":  5,
    "current_phase":  "RUNNER",
    "current_task":  "terminal: ",
    "completed_tasks":  [
                            "Merge integer time intervals and compute gaps and peak concurrency"
                        ],
    "pending_tasks":  [

                      ],
    "acceptance_criteria":  [
                                "Merge integer time intervals and compute gaps and peak concurrency; immutable acceptance and documented CLI verified"
                            ],
    "current_delegation_id":  null,
    "hermes_session_id":  null,
    "qwen_session_id":  null,
    "git":  {
                "branch":  "agent/f25-20261015-050751-1239ed-11",
                "head":  "5aee9a8",
                "dirty":  true,
                "changed_files":  [
                                      "README.md",
                                      "module.py"
                                  ]
            },
    "tests":  {
                  "status":  "PASS",
                  "last_command":  null,
                  "last_exit_code":  null,
                  "last_run_at":  null
              },
    "build":  {
                  "status":  "PASS",
                  "last_command":  null,
                  "last_exit_code":  null
              },
    "progress":  {
                     "score":  0,
                     "last_progress_at":  null,
                     "no_progress_cycles":  0
                 },
    "failure":  {
                    "last_signature":  null,
                    "repeated_count":  0
                },
    "checkpoint":  {
                       "last_id":  null,
                       "last_created_at":  null
                   },
    "next_action":  "Continuar ejecución de tarea pendiente: Merge integer time intervals and compute gaps and peak concurrency"
}