{
    "schema_version":  "1.0",
    "run_id":  "run-20261015-132221",
    "project_id":  "task-016-csv-ledger",
    "objective":  "Normalize CSV ledger rows and aggregate exact decimal amounts",
    "status":  "COMPLETED",
    "created_at":  "2026-10-15T13:22:21.7668977-03:00",
    "updated_at":  "2026-10-15T13:29:17.0232690-03:00",
    "cycle":  0,
    "max_cycles":  5,
    "current_phase":  "RUNNER",
    "current_task":  "terminal: ",
    "completed_tasks":  [
                            "Normalize CSV ledger rows and aggregate exact decimal amounts"
                        ],
    "pending_tasks":  [

                      ],
    "acceptance_criteria":  [
                                "Normalize CSV ledger rows and aggregate exact decimal amounts; immutable acceptance and documented CLI verified"
                            ],
    "current_delegation_id":  null,
    "hermes_session_id":  null,
    "qwen_session_id":  null,
    "git":  {
                "branch":  "agent/4h-20261015-110202-059517-16",
                "head":  "99d450b",
                "dirty":  true,
                "changed_files":  [
                                      "README.md",
                                      "module.py"
                                  ]
            },
    "tests":  {
                  "status":  "PASS",
                  "last_command":  null,
                  "last_exit_code":  null,
                  "last_run_at":  null
              },
    "build":  {
                  "status":  "PASS",
                  "last_command":  null,
                  "last_exit_code":  null
              },
    "progress":  {
                     "score":  0,
                     "last_progress_at":  null,
                     "no_progress_cycles":  0
                 },
    "failure":  {
                    "last_signature":  null,
                    "repeated_count":  0
                },
    "checkpoint":  {
                       "last_id":  null,
                       "last_created_at":  null
                   },
    "next_action":  "Ejecutar preflight checks y autorizar el inicio del ciclo"
}